[
	{
		"id": "prop_tombstone_01",
		"sizeClass": "medium",
		"kind": "blocking",
		"radius": 0.45,
		"height": 1.25
	},
	{
		"id": "prop_tombstone_02",
		"sizeClass": "medium",
		"kind": "blocking",
		"radius": 0.4,
		"height": 1.06
	},
	{
		"id": "prop_dead_tree_01",
		"sizeClass": "large",
		"kind": "blocking",
		"radius": 0.35,
		"height": 3.19
	},
	{
		"id": "prop_crypt_01",
		"sizeClass": "large",
		"kind": "blocking",
		"radius": 1.3,
		"height": 2.75
	},
	{
		"id": "prop_bone_01",
		"sizeClass": "small",
		"kind": "decor",
		"radius": 0.2,
		"height": 0.31
	},
	{
		"id": "prop_grass_01",
		"sizeClass": "small",
		"kind": "decor",
		"radius": 0.1,
		"height": 0.5
	},
	{
		"id": "prop_urn_01",
		"sizeClass": "small",
		"kind": "breakable",
		"radius": 0.3,
		"height": 0.69,
		"hp": 12
	},
	{
		"id": "prop_cross_01",
		"sizeClass": "medium",
		"kind": "decor",
		"radius": 0.25,
		"height": 1.19
	},
	{
		"id": "prop_fence_01",
		"sizeClass": "medium",
		"kind": "decor",
		"radius": 0.9,
		"height": 1.25
	},
	{
		"id": "prop_bonepile_01",
		"sizeClass": "medium",
		"kind": "decor",
		"radius": 0.5,
		"height": 1
	},
	{
		"id": "prop_swamp_stump_01",
		"sizeClass": "medium",
		"kind": "blocking",
		"radius": 0.34,
		"height": 1.25
	},
	{
		"id": "prop_swamp_tree_01",
		"sizeClass": "large",
		"kind": "blocking",
		"radius": 0.4,
		"height": 3.19
	},
	{
		"id": "prop_swamp_hut_01",
		"sizeClass": "large",
		"kind": "blocking",
		"radius": 1.09,
		"height": 2.75
	},
	{
		"id": "prop_swamp_bonearch_01",
		"sizeClass": "large",
		"kind": "blocking",
		"radius": 1.25,
		"height": 2.75
	},
	{
		"id": "prop_reeds_01",
		"sizeClass": "small",
		"kind": "decor",
		"radius": 0.2,
		"height": 1.19
	},
	{
		"id": "prop_swamp_skull_01",
		"sizeClass": "small",
		"kind": "decor",
		"radius": 0.34,
		"height": 0.5
	},
	{
		"id": "prop_mushroom_01",
		"sizeClass": "small",
		"kind": "decor",
		"radius": 0.31,
		"height": 0.69
	},
	{
		"id": "prop_swamp_log_01",
		"sizeClass": "medium",
		"kind": "decor",
		"radius": 0.44,
		"height": 0.56
	},
	{
		"id": "prop_swamp_jar_01",
		"sizeClass": "small",
		"kind": "breakable",
		"radius": 0.22,
		"height": 0.72,
		"hp": 12
	},
	{
		"id": "prop_swamp_nest_01",
		"sizeClass": "small",
		"kind": "breakable",
		"radius": 0.41,
		"height": 0.63,
		"hp": 20
	},
	{
		"id": "prop_anvil_01",
		"sizeClass": "medium",
		"kind": "blocking",
		"radius": 0.75,
		"height": 1.06
	},
	{
		"id": "prop_chimney_01",
		"sizeClass": "large",
		"kind": "blocking",
		"radius": 0.69,
		"height": 3.94
	},
	{
		"id": "prop_furnace_01",
		"sizeClass": "large",
		"kind": "blocking",
		"radius": 1.19,
		"height": 3.56
	},
	{
		"id": "prop_gearpile_01",
		"sizeClass": "medium",
		"kind": "blocking",
		"radius": 0.63,
		"height": 1.19
	},
	{
		"id": "prop_chain_01",
		"sizeClass": "small",
		"kind": "decor",
		"radius": 0.44,
		"height": 0.25
	},
	{
		"id": "prop_slag_01",
		"sizeClass": "small",
		"kind": "decor",
		"radius": 0.44,
		"height": 0.59
	},
	{
		"id": "prop_emberrock_01",
		"sizeClass": "small",
		"kind": "decor",
		"radius": 0.41,
		"height": 0.91
	},
	{
		"id": "prop_pipe_01",
		"sizeClass": "medium",
		"kind": "decor",
		"radius": 0.44,
		"height": 0.75
	},
	{
		"id": "prop_barrel_01",
		"sizeClass": "small",
		"kind": "breakable",
		"radius": 0.31,
		"height": 0.75,
		"hp": 12
	},
	{
		"id": "prop_crate_01",
		"sizeClass": "small",
		"kind": "breakable",
		"radius": 0.41,
		"height": 0.78,
		"hp": 20
	},
	{
		"id": "prop_pod_01",
		"sizeClass": "medium",
		"kind": "blocking",
		"radius": 0.53,
		"height": 1.56
	},
	{
		"id": "prop_eggcluster_01",
		"sizeClass": "large",
		"kind": "blocking",
		"radius": 1.03,
		"height": 2.06
	},
	{
		"id": "prop_spire_01",
		"sizeClass": "large",
		"kind": "blocking",
		"radius": 0.75,
		"height": 5.25
	},
	{
		"id": "prop_tank_01",
		"sizeClass": "large",
		"kind": "blocking",
		"radius": 1,
		"height": 2.75
	},
	{
		"id": "prop_cable_01",
		"sizeClass": "small",
		"kind": "decor",
		"radius": 0.44,
		"height": 0.25
	},
	{
		"id": "prop_circuit_01",
		"sizeClass": "small",
		"kind": "decor",
		"radius": 0.44,
		"height": 0.25
	},
	{
		"id": "prop_antenna_01",
		"sizeClass": "medium",
		"kind": "decor",
		"radius": 0.31,
		"height": 2.13
	},
	{
		"id": "prop_mesh_01",
		"sizeClass": "medium",
		"kind": "decor",
		"radius": 0.44,
		"height": 1.19
	},
	{
		"id": "prop_egg_01",
		"sizeClass": "small",
		"kind": "breakable",
		"radius": 0.34,
		"height": 0.88,
		"hp": 12
	},
	{
		"id": "prop_canister_01",
		"sizeClass": "small",
		"kind": "breakable",
		"radius": 0.28,
		"height": 0.88,
		"hp": 12
	}
]
